,FileName,Description
1457,142453.jpg,"A young girl with dark hair. Her eyebrows are brown and they are drawn. Her eyes are green. Her lips are curved into something resembling a smile, though she is not smiling. Her skin tone is olive."
1458,182548.jpg,"A brunette woman with long, wavy hair. She has a slight tan and a strong jaw with a cleft chin."
1459,016331.jpg,"A female face with big dark eyes, full lips and a straight nose. She has long straight dark brown hair and very defined eyebrows."
1460,093153.jpg,A woman with tanned skin and dark-coloured hair. Her hair is pulled backwards and set in an upstyle. She has also got a fringe. The girl is looking down and her eyelids are coloured in eyeshadow and eyeliner. She is wearing heavy make-up around the eyes. Her lips are small and she has got a heavy lower lip. Her lips are slightly parted.
1461,044319.jpg,"A man with a small nose, small ears and reddish skin. He is wearing a cap with a pair of sunglasses on it and he appears to be screaming."
1462,044319.jpg,A middle-aged man wearing a blue cap and a pair of sunglasses with a white frame. He seems to be screaming at the top of his lungs. His mouth is open and his teeth are visible. A stubble beard is growing around his lips
1463,021213.jpg,"A man with bushy eyebrows, prominent cheekbones and a chiselled jaw. He has a small nose, light eyes and short, spiked-up, brown hair."
1464,021213.jpg,A young man with short brown hair and a well-defined jawline. His eyes are blue and his eyebrows are thick. His lips are thin. He looks indifferent
1465,017238.jpg,"A woman with long, wavy blond hair and a thin nose. She has prominent eyebrows and is wearing makeup."
1466,017238.jpg,A woman with wavy blonde hair of medium-length. Her eyebrows are painted brown and they're thick. Her eyes are wide open and there is black make-up around them. She has got full lips and they're painted pink.
1467,189917.jpg,A middle-aged woman with straight brown hair and a fringe. Her eyes are dark-coloured and there is some dark make-up around them. Her lips are thin and her upper teeth are visible. She is wearing a pair of earrings
1468,011621.jpg,"A woman with tied-back, light-brown hair and pale, reddish skin. She has thick, sculpted eyebrows, full lips and soft features."
1469,011621.jpg,A young girl with styled hair pulled back. She seems to have no make-up on and looks very natural. Her eyebrows are full and arched. Her nose is somewhat wide and her lips are full. Her lips are parted and her teeth can be seen. She is wearing a pair of big earrings.
1470,153126.jpg,A lady with long gathered grey and blue eyes. She has a slightly wide nose and thin red lips.
1471,179624.jpg,"A pale woman with a strong jaw, thin lips, green eyes, thin eyebrows and long, wavy, blond hair."
1472,179624.jpg,A young girl with long wavy blonde hair and brown roots. Her eyebrows are brown and her eyes are blue. There is some black make-up around the girl's eyes/ Her lips are thin and they are slightly parted. Her upper teeth are visible.
1473,073885.jpg,An old woman with short brown hair and blue eyes. She is wearing a pair of glasses. Her lips are thin and they are painted red. She is smiling. She is wearing a pair of earrings
1474,184663.jpg,"A pale womaan with long, red hait and bangs. She has prominent rosy cheeks, a pointed nose and a smile with dimples."
1475,120300.jpg,"An older man with short, dark-brown hair and glasses. He has a stubble beard and sideburns, with a slight grin."
1476,082314.jpg,A young woman with dark hair and small eyes with dark make-up around them. Her nose is small and her lips are round. Her upper teeth are visible.
1477,125086.jpg,"A pale woman with shoulder-length, blond, bouffant hair. She has a large forehead, thin eyebrows, light eyes, a large nose and full lips."
1478,125086.jpg,A young girl with blonde hair and brown roots. Her eyes are blue and there is some dark make-up around them. Her lips are somewhat thick and they are stretched into a smile.
1479,038626.jpg,A young man with short brown hair and small dark eyes. His nose and lips are small. His upper teeth are visible. A stubble beard is growing on the man's face and he has got a moustache
1480,145715.jpg,"A bald black man with a wide, flat nose, full lips and dark eyes."
1481,145715.jpg,"A young bald dark-skinned man. His eyes are small, his nose is wide and his lips are wide and thick. He looks tired but determined. He is holding up a finger."
1482,142289.jpg,A man with light blonde wavy hair. He has got a serious look in his eyes although there is a hint of a smile. His lips are thin.
1483,072571.jpg,"A smiling woman with a sharp jaw and long, straight,  blond hair. She is wearing heavy makeup."
1484,141091.jpg,"A man with a full head of grey hair, black eyes and quite a big nose. He has thin lips and a chubby face."
1485,059852.jpg,"A woman with long, wavy, brunette hair, makeup, thin, sculpted eyebrows, a long nose and dark eyes."
1486,059852.jpg,A young Chinese-looking girl with straight dark  hair and big eyes. There is black make-up around her eyes. Her  nose is small and her lips are thin
1487,172996.jpg,A young girl with straight long dark-coloured hair. Her eyes are brown and there is some black make-up around them. Her lips are painted in red lipstick and they are stretched wide into a smile. The girl is wearing a pair of earrings.
1488,074080.jpg,"A slightly tanned man with short, black hair, a full beard, a wide nose and glasses."
1489,049944.jpg,"A man with protruding ears, a narrow nose, thick eyebrows, full lips and droopy features."
1490,049944.jpg,A thin man wearing a black cap. His eyebrows are quite thick and his eyes are dark-coloured. His lips are wide and the edges well-defined. Hints of a beard can be seen on the man's face. He has got a round face.
1491,132322.jpg,A dark-skinned man with a shaved head and bushy eyebrows. He has a moustache and a trimmed chinstrap beard.
1492,132910.jpg,"A sad looking woman wearing earrings, black eyeliner and eye shadow, having messy light brown hair and small plump lips."
1493,042384.jpg,"A man with grey hair and stubble. He has light green eyes, a slightly wide nose and very narrow lips."
1494,124046.jpg,"A woman with a strong jaw, high cheekbones, full lips, sculpted eyebrows and long, frizzy, brown hair."
1495,126227.jpg,A young  woman with dark hair pulled back. Her eyes are small and her nose is small. Her lips are thin and she looks serious
1496,006800.jpg,A young man with long wavy blonde hair and big brown eyes. His lips are somewhat thick. A beard has grown on his chin.
1497,140078.jpg,A middle-aged man with short hair and a receding hairline. His skin seems wrinkled. His eyes are dark and big and his lips are thin. 
1498,111742.jpg,"A blonde woman with long straight hair. She has full lips, thin eyebrows and she is wearing makeup."
1499,176972.jpg,A young man with medium-length wavy brown hair and small blue eyes. His nose is somewhat wide and his lips are thin. He is smiling and his upper teeth are visible. His jawline is well-defined
1500,098016.jpg,A young man with short dark hair and small blue eyes. His nose is small and his lips are small. A stubble beard is growing on his face. He is smiling. His upper teeth are slightly visible
1501,058292.jpg,A young dark-skinned woman with dark hair pulled backwards. Her eyes are dark and there is some make-up around them. Her lips are thin although she has got a heavy lower lip. Her lips are painted with lipstick. Her upper teeth are visible and she is smiling
1502,130053.jpg,A young lady with medium-length brown hair and a brown slanted fringe. Her eyes are brown and there is some light blue make-up around them. Her lips are heard shaped. She is smiling.
1503,041779.jpg,"An older, dark-skinned man with a large nose. He has short, greying hair but he is also balding. He has a slight smile and a double chin."
1504,041779.jpg,A middle-aged man with short dark hair and patches of white hair. His eyes are dark-coloured. His cheeks are puffy. His lips are somewhat thick and his upper teeth are visible. He has got a double chin.
1505,066590.jpg,"A pale woman with short, ginger hair and a pointed chin. She has full cheeks, full lips and she is wearing makeup."
1506,167857.jpg,"A pale woman with a strong jaw, full lips, a small nose, brunette hair and a hat."
1507,133460.jpg,"An elderly man with a reddened skin tone, grey hair and stubble, with close set blue eyes and a large mouth and chin."
1508,195058.jpg,"A man with a long face, a long nose and a strong jaw with a prominent chin. He has one raised eyebrow and short, black hair."
1509,195058.jpg,A young man with short brown hair and thick brown eyebrows. One of his eyebrows is raised. His eyes are dark-coloured. His lips are thin and his mouth is open.
1510,165533.jpg,A girl with brown skin that looks suntanned. Her hair is brown and it is wavy. She is wearing natural make-up. Her eyes are dark-coloured and small. She has got full lips and they are parted.
1511,104868.jpg,A young woman with tied-back brunette hair and a white tennis cap. 
1512,104868.jpg,A young girl wearing a Nike tennis hat. Her hair is brown. Her eyes are dark-coloured and there is dark make-up around them. Her lips are thin and her front teeth are visible. She seems to be frowning
1513,004079.jpg,"A black woman with short, straight, black hair and a wide smile with dimples. She has sculpted eyebrows, full cheeks and is wearing makeup."
1514,004079.jpg,A young girl with darker skin and dark-coloured hair pulled back. She has also got a fringe on both sides of her forehead. Her eyes are dark-coloured and there is some make-up around them. Her upper teeth are visible and she is smiling. She has got a heavy lower lip
1515,074275.jpg,A man with short black hair and bushy eyebrows. He has a wide nose and he is clean-shaven.
1516,081959.jpg,"A dark-skinned man with short, black hair, a white cap, full lips and a round face with a patchy beard and a moustache."
1517,081959.jpg,A young man wearing a white cap. His hair is dark-coloured and his eyes are dark and small. His lips are thin and he is smiling. A stubble has grown all along his jawline and on his upper lip
1518,105843.jpg,"A man with high cheekbones, a sharp jawline, full lips, a large nose and medium-length, wavy, brown hair."
1519,036949.jpg,"A bald man with a wide jaw and nose. He is smiling and has a long, oval-shaped face."
1520,036949.jpg,A middle-aged bald man with a chubby face. His eyes are small and he has got a heavy lower lip. He has got a double chin. There seems to be some hint of a smile on his face
1521,071838.jpg,An Asian woman with a wide nose and a bright smile. She has a brown bowl cut and thin eyebrows.
1522,071838.jpg,A young Chinese-looking woman with short brown hair and small dark eyes with some make-up above them. Her nose is small and her lips are thin. She is smiling and her upper teeth are visible
1523,005902.jpg,"An Asian woman with black hair, tied up in a top knot. She has full lips, full cheeks and soft features."
1524,005902.jpg,A young Chinese-looking girl with her hair tied up into a bun. Her eyes are dark-coloured and small and there is some make-up around them. Her lips are thin and she is smiling
1525,047259.jpg,A middle-aged Korean-looking man with short hair combed backwards and small dark eyes. He is wearing a pair of glasses and his lips are thin. He is smiling
1526,113842.jpg,"A young man with blue eyes and bushy eyebrows. He has short, light-brown hair and a strong jaw. He has a chinstrap beard, a soul patch and a moustache."
1527,113842.jpg,"A blue eyed man with messy brown hair, a large nose, sparse peach fuzz beard and an intimidated expression."
1528,102401.jpg,A young girl with short straight brown hair and a slanted fringe. She is looking sideways with her small dark eyes. She is smiling with her lips parted and her teeth are visible. 
1529,075868.jpg,"A woman with short brown hair, black eyes and a bulbous nose. She has a round face."
1530,110446.jpg,A middle-aged woman with short brown hair and big blue eyes with fancy make-up around them. Her nose is small and her lips are full. Her lips are painted pink. The woman seems to be shocked.
1531,199028.jpg,"A woman with slightly wavy, light-brown hair which falls to her shoulders. She has light eyes, pale skin, a small nose and she is wearing makeup."
1532,199028.jpg,A young woman with blonde hair and dark roots. Her eyes are blue and there is some dark make-up above her eyes. Her lips are thin and they are painted red. She looks serious
1533,004991.jpg,"An Asian man with a strong jawline and a prominent chin. He has very bushy eyebrows and long, black hair with a fringe."
1534,004991.jpg,"A thin, young Chinese-looking male with medium-length brown hair. His eyebrows are thick and his eyes are small and narrow. His lips are thin."
1535,077923.jpg,"A dark-skinned old man with white hair, a plump face, a small nose and a pair of sunglasses."
1536,077923.jpg,An old man with medium-length white hair. He is wearing a pair of rectangular sunglasses. His skin looks tanned. His lips are thin and hints of a stubble beard can be seen around them.
1537,134174.jpg,"An Asian woman with long, wavy brown hair. She has a large nose, a wide toothy smile and she is wearing makeup."
1538,141892.jpg,"A young man with short, wavy, brown hair and bushy eyebrows. He has light blue eyes and a slight beard and moustache."
1539,141892.jpg,A young man with short brown hair and thick brown eyebrows. His eyes are blue. His lips are very thin and a beard is growing around them.
1540,087442.jpg,"A tanned man with a rectangular face, a strong jaw, a large chin, a small nose, narrow eyes, bushy eyebrows and a large forehead. His hair is short, dark-brown and spiked up."
1541,087442.jpg,A young man with short dark-coloured hair. His eyebrows are dark and bushy. His eyes are small and they are blue. His lips seem very thin and his upper teeth are visible. A stubble beard is growing. The man has got a square jaw.
1542,031358.jpg,"A black man with short dark hair, a wide nose and dark full lips. He has a white smile."
1543,023999.jpg,A young man wit short brown hair. The hair on the sides of his head is shaved. His eyes are blue and bright. His lips are thin and they are stretched into a smile. His lips are parted in a way that his upper teeth are visible. A stubble beard is growing around his lips.
1544,108329.jpg,"A woman with pale skin, long, wavy, black hair, sculpted eyebrows and full lips."
1545,008003.jpg,"A pale woman with short, blond hair, dark eyebrows, a small nose, a sharp jawline and some makeup."
1546,061959.jpg,"A black man with shaved hair, protruding ears, a moustache and full, smiling lips. He has dimples and full cheeks."
1547,198751.jpg,A male face with very little hair and a very short stubble beard. He has slanted eyes and pursed lips.
1548,198751.jpg,"A man with a stern look. He has white hair on the sides of his head and short, yet very little, hair in the middle of his head.  He has small eyes and ears. Around his lips a stubble beard is growing."
1549,183707.jpg,"A woman with long, wavy, brunette hair and a wide smile. She has a sharp chin, sculpted eyebrows and is wearing light makeup."
1550,183707.jpg,"A young woman with a wide toothy smile, narrow arched eyebrows and long wavy brown hair."
1551,098414.jpg,A pale young man with a light-brown combover and a trimmed beard. He has brown eyes and a thin smile.
1552,098414.jpg,A young man with light brown hair and small brown eyes. His lips are thin and they are curved into a smile. A stubble bears is growing on his face.
1553,172712.jpg,"A woman with light brown hair, narrow dark eyes and a wide nose. He also has quite full lips."
1554,172712.jpg,A middle-aged man with short wavy brown hair parted in the middle. His eyes are dark-coloured and small. His lips are thin and he has got a heavy lower lip. 
1555,089296.jpg,"A middle-aged woman with brown hair and small dark eyes. There is some dark make-up around them, Her nose is small and her lips are somewhat thick. She seems to be smiling"
1556,071228.jpg,A woman with brown hair tied at the back of her head. She has got a slanting fringe. Her eyes are bright blue and there is black make-up around them. Her lips are thin and she is smiling. Her face is resting upon her hand.
1557,173757.jpg,"A man with a pale complexion, short styled dark hair, black deep set eyes and full lips. He has a light stubble beard."
1558,077609.jpg,An old man with grey hair wearing a pair of round glasses with a thick dark frame. His eyes are brown and small. His lips are very thin and he seems to be biting his lower lip. The man has got many wrinkles on his face.
1559,013184.jpg,"A plump man with short, black hair, a small nose, thin lips, thin eyebrows and a prominent chin."
1560,013184.jpg,A young chubby man with short dark hair and small eyes. His nose and lips are small. He has got a double chin. He looks serious.
1561,176131.jpg,A young bald man with small eyes and thick eyebrows. His nose is somewhat big and his lips are thick. He seems to be squinting. Hints of a stubble can be seen around his lips
1562,126800.jpg,A young girl with tanned skin and brown hair. Her eyes are brown and there is some black make-up around them. Her lips are thin and she has got a heavy lower lip. Her upper teeth are visible. She is smiling
1563,108556.jpg,A woman with light brown gathered hair and thin lips.
1564,108556.jpg,A young lady with brown hair pulled up and a curtain fringe. She is wearing a pair of sunglasses and she is smiling. Her upper teeth are visible.
1565,018453.jpg,A blonde woman with a straight nose and pink lips. Her hair is pulled back with a head band.
1566,155583.jpg,"A smiling, Asian woman with thin eyebrows, brown eyes and dark-brown, tied-back hair. She is wearing makeup."
1567,165859.jpg,A young woman with short brown hair and bright blue eyes. She squints. There is dark make-up around them. Her lips are heart-shaped and they are painted pink. She is smiling
1568,012438.jpg,"An east asian woman with short black hair, pursed lips and narrow eyes, wearing pale makeup and red lipstick."
1569,124163.jpg,"A black man with short, black hair and a goatee. He is slightly plum and has large ears and a wide nose."
1570,124163.jpg,A young dark-skinned man with short dark-coloured hair and dark eyes. His lips are thick and his upper teeth are visible. He has got a beard around his lips. He is wearing a necklace.
1571,036950.jpg,"A woman with long, dark-brown, neatly tied-back hair and light makeup. She has thick eyebrows, dark eyes, full lips and a wide nose."
1572,036950.jpg,A young girl with dark hair combed backwards and pulled into a ponytail. Her eyes are dark-coloured and small and her lips are thin and painted pink. She is wearing a pair of earrings. Her jawline is well-defined.
1573,099067.jpg,"A smiling older man with medium-length, curly, light-brown hair. He has a large nose and a grey goatee."
1574,099067.jpg,A middle-aged man with curly blonde hair and dark small eyes. His nose is relatively big. His lips are thin and he is smiling. His upper teeth are visible. A stubble beard has grown on his upper lip whereas he has got a goatie on his chin
1575,076439.jpg,"A tanned, Asian woman with long, dark-brown hair, sculpted eyebrows, a small nose and some makeup."
1576,076439.jpg,A young woman with brown hair and small dark eyes with dark make-up around them. Her nose is small and her lips are thin. She is wearing a pair of earrings
1577,093732.jpg,"A black man with a shaved head and bushy eyebrows. He has a goatee, a wide nose, full lips and full cheeks."
1578,093732.jpg,A young dark-skinned male with short dark hair and small dark eyes. His lips are thick and a beard is growing around them.
1579,041627.jpg,A young lady with long brown hair parted in the middle. Her hair is dyed blonde at the edges. Her eyes are small and there is black make-up around them. Her lips set in a straight line and the woman has got a blank face.
1580,023407.jpg,A young man with short brown hair and a receding hairline. His eyes are small and dark-coloured and his lips are wide and slightly parted. His upper teeth can be seen. A stubble beard is growing on his face.
1581,117263.jpg,"A woman with light-blue eyes, and long, wavy, brunette hair. She has thin eyebrows and is wearing makeup."
1582,117263.jpg,A middle-aged woman with dark hair and big blue eyes. There is thick black make-up around her eyes. Her lips are thin and her upper teeth are visible
1583,020237.jpg,A young man with short brown hair and small dark eyes. He is wearing a pair of goggles. His nose is small and his lips are thin. Hints of a moustache can be seen on his face
1584,054520.jpg,A young man with medium-length straight dark-coloured hair and big dark eyes. His lips are somewhat thick. He looks serious. He has got a well-defined jawlinwe
1585,062447.jpg,"A man with reddish skin, messy brunette hair, green eyes and a full beard. He has full lips, a wide nose and bushy eyebrows."
1586,062447.jpg,A middle-aged man with medium-length dark hair and blue eyes. His nose is small and his lips are thin. A beard is growing around his lips. He is smiling softly
1587,151457.jpg,"A black man with a short stubble beard, dark slanted eyes and a pointed nose. He has very full lips."
1588,151457.jpg,A middle-aged dark-skinned man with short dark hair and sweat on his face. His eyes are dark-coloured and his lips are thick. A stubble beard is growing on his fac
1589,094937.jpg,"A dark-skinned woman with wavy, long, black hair, dark eyes and sculpted eyebrows. She has full lips and she is wearing makeup."
1590,094937.jpg,A young girl with tanned skin and voluminous wavy hair. Her eyes are dark-coloured and there is some natural looking make-up around them. Her lips are painted red. Her lips are thin. The girl is smiling. 
1591,191211.jpg,"A black woman with long, wavy, black hair, dark eyes, a wide nose and a beaming grin. She has a plump, round face and sculpted eyebrows."
1592,191211.jpg,A young dark-skinned woman with wavy black hair and black eyes with some make-up around them. She seems chubby. Her lips are thin and she has got a heavy lower lip. Her teeth are visible. She is wearing a pair of earrings
1593,028101.jpg,"A woman with short, dark-brown hair, a small nose, closed eyes and a cleft chin. She is pouting her lips and wearing makeup."
1594,179572.jpg,A young woman with blonde hair and darker roots. Her eyes are dark-coloured and her lips are thin. Her lips are painted red.
1595,050282.jpg,"A man with short, wavy, dark-brown hair and a receding hairline. He has a long nose, a strong jaw and a smile."
1596,050282.jpg,A middle-aged man with short dark hair and small eyes. His eyebrows are thick and one of them is raised. His nose is narrow and his lips are  thin. He is smiling.
1597,067199.jpg,"An Asian woman with short, black hair and a fringe. She has a round face, thick eyebrows, dark eyes, full cheeks and a smile."
1598,067199.jpg,An Asian-looking woman with short dark-coloured hair and a slanted fringe. Her eyes are dark-coloured and big and her lip are thin. Her lips are parted as they're set into a smile and her teeth are showing.
1599,134322.jpg,An old man with grey hair and a receding hairline. Wrinkles can be seen. His eyes are wide open and his nose is small. His lips are closed and his lower lip is protruding.
1600,177366.jpg,"A woman with a round face, a cleft chin and full cheeks. She has short, black hair, green eyes and full lips."
1601,177366.jpg,A young woman with short dark hair and big blue eyes. Her nose is small and her lips are somewhat thick. She is smiling
1602,058158.jpg,A young dark-skinned woman with braided hair. Her eyes are dark-coloured and small and her lips are somewhat thick. She has got a big smile. Her upper teeth are visible
1603,183771.jpg,"A woman with a sharp jawline, prominent cheekbones, full lips and sculpted eyebrows. She has long, slightly wavy, brunette hair."
1604,089917.jpg,A young woman with a round face with very full cheeks. She has straight chocolate brown hair and same colour eyes. Her nose is narrow and pointed and her lips are thin and pink.
1605,089917.jpg,A young woman with straight brown hair and big dark eyes with dark make-up around them. Her lips are thin and they are painted pink. Her upper teeth are visible. She is smiling
1606,077560.jpg,A smiling man with thin eyebrows and short hair. He has a large nose and a square jaw with a cleft chin.
1607,199020.jpg,A young man with short dark hair and small dark eyes. His nose is small and his lips are thin. His upper teeth are visible as he is smiling. His jawline is well-defined
1608,114890.jpg,"A black woman with shoulder-length dreadlocks, thick, sculpted eyebrows, a wide nose, full lips and some makeup. She is wearing gold hoop earrings and a gold choker."
1609,114890.jpg,A young dark-skinned woman with dread locked hair. Her eyes are dark and small and there is make-up around them. Her nose is wide and her lips are thick. Her upper teeth are visible and she is smiling. She is wearing a pair of hoop earrings.
1610,131755.jpg,"An older man with brown, receding hair, blue eyes, bushy eyebrows, a crooked nose and a wrinkly, long face."
1611,137710.jpg,"A woman with long, reddish-brown hair and rosy cheeks. She is smiling and wearing light makeup."
1612,137710.jpg,A young woman with long light brown hair. She has got a fringe on the side of her forehead. Her eyebrows are somewhat thick and round - they are not arched. Her eyes are small and they are brown. She has got rosy cheeks. Her lips are painted in a natural colour and she is smiling.
1613,194213.jpg,"A man with long scruffy black hair, full lips and big dark sunglasses."
