,FileName,Description
2911,064603.jpg,A young man with short blonde hair and a receding hairline. He has got a blue circle on his forehead. His eyes are blue and they're very small and narrow. His nose is wide and his lips are thin. His lips are stretched into a smile.
2912,086756.jpg,A balding man with short black hair and a big nose. He has a cleft chin and a slightly wrinkled brow.
2913,170219.jpg,"A young man with short, wavy, dark-brown hair, blue eyes and thin eyebrows. He has a sharp jawline and otherwise soft features."
2914,177332.jpg,A young woman with wavy brown hair and big dark eyes with make-up around them. Her lips are thin and she is smiling
2915,003105.jpg,A woman with long blonde hair and bangs put to the side of her forehead. She has big eyes and full lips and is wearing makeup.
2916,115830.jpg,A woman with wavy blond hair and makeup. She has a thin nose and a slight grin.
2917,129266.jpg,"A black woman with long dark straight hair, big black prominent eyes, a wide nose and a big white smile."
2918,113161.jpg,"A man with short, brown hair, a strong jaw and a large chin. He has a wide nose, dark eyes and a smile with dimples."
2919,113161.jpg,A young man with short brown hair and small dark eyes. His lips are thin and his upper teeth are visible.  He is smiling. A stubble is growing on his face
2920,190291.jpg,"A man with long, straight, black hair, a large nose and a pair of sunglasses. He is pouting his lips and he has hollow cheeks and a strong jaw."
2921,144773.jpg,"A black man with full lips and a cleft chin. He is wearing sunglasses and a pink, backwards-turned cap."
2922,144773.jpg,A young dark-skinned man with a cap worn backwards. He is wearing a pair of black sunglasses. His nose is small and his lips are wide
2923,052352.jpg,"A man with short brown hair, thin brown eyebrows, small dark-coloured eyes and a heavy lower lip. His lips are parted and his teeth are visible. He has got a stubble beard."
2924,076955.jpg,"A tanned woman with long, black hair, a fringe, sculpted eyebrows and full cheeks and lips. She is wearing makeup and hoop earrings."
2925,076955.jpg,"A young woman with dark hair, small dark eyes with make-up around them, thick lips and a small nose. She has got a dimple on her face. She is smiling and she is wearing a pair of earrings"
2926,048621.jpg,An Asian man with slicked-back black hair. He has a round face with a prominent chin ad dark eyes.
2927,048621.jpg,A middle-aged man with short dark hair combed backwards. His eyes are dark and small and his nose is small. His lips are thin and they are pressed together into a smile
2928,001343.jpg,"A man with short, spiky, light-brown hair and a weak chin. He has a trimmed beard and an open mouth."
2929,156491.jpg,"An older man with grey hair and bushy eyebrows. He has a thin nose, a wrinkled, furrowed brow and a strong jaw."
2930,156491.jpg,A middle-aged man with short grey hair and small eyes. His nose is small and his lips are thin. He is looking to his side.
2931,020566.jpg,"A young boy with short brown messy hair, brown eyes and a somewhat defined jawline. He looks serious. He has got a beauty spot on his enck. "
2932,005475.jpg,"A woman with long, straight, blond hair and blue eyes. She has sculpted eyebrows, prominent cheekbones and a strong jaw."
2933,111128.jpg,A man with medium-length curly hair. He has a large nose and full eyebrows.
2934,111128.jpg,A young man with frizzy curly dark hair. He is looking down. His nose is arched and his lips are thin. His lips are slightly parted and his front teeth are visible
2935,022681.jpg,A young Chinese-looking man with short messy  dark hair and small dark eyes. There is a beauty spot under his eye. His lips are thin and a beard is growing around them. He is smiling
2936,000746.jpg,"A woman with long, straight, brown hair. She has full lips and sculpted eyebrows."
2937,000746.jpg,A young woman with small dark eyes with some make-up around them. Her lips are thin and she is smiling
2938,103911.jpg,"A pale man with short, black hair, sideburns and a trimmed beard. He has a large nose and a slight smile."
2939,103911.jpg,"A young man with dark hair combed back. His eues are small, his nose is straight and his lips are thin. The man's lips are slightly parted and his teeth are showing. The man has a stubble beard."
2940,025056.jpg,"A man with a 5 o'clock shadow and sunglasses. He has tanned skin and short, black hair."
2941,025056.jpg,A young man with short dark hair. He is wearing a pair of aviator sunglasses. His lips are slightly parted and he seems to be amused. A stubble beard is growing on his face. His ear is pierced
2942,102044.jpg,"A pale, blond man with short hair, narrow, blue eyes a wrinkly face and barely visible eyebrows."
2943,119120.jpg,"A pale man with short, white-blond hair, blue eyes, a small nose and a strong jaw with a slight cleft chin."
2944,125342.jpg,"A woman with long, blond hair, dark roots, a pointed nose, a round face and full cheeks. She is wearing makeup and has thin eyebrows."
2945,167155.jpg,"A man with short, spiked-up, black hair which is shaved at the sides. He has large ears, a chiselled jaw, thick eyebrows and a 5 o'clock shadow."
2946,080415.jpg,A pale skinned frowning middle aged man with curly ginger hair and small eyes.
2947,121515.jpg,"A woman with straight, black hair and bangs. She has  a wide nose and full lips, with soft features."
2948,117791.jpg,"A woman with long wavy black hair, black eyes and full lips. She is wearing big loop earrings."
2949,117791.jpg,A young woman with dark curled hair and small dark eyes with dark make-up around them. Her nose is small and her lips are somewhat thick. She is smiling. She is wearing a pair of hoop earrings
2950,139231.jpg,"A black man with a shaved head, a stubble beard and a beaming smile. He has a strong jaw, a wide nose, full lips and sliight bags under his eyes."
2951,080105.jpg,A young girl with long wavy blonde hair and a fringe. Her roots are a little darker. Her eyebrows are brown and her eyes are blue. Black make-up can be seen around her eyes. Her lips are small and they are painted pink. The girl is smiling.
2952,097851.jpg,"A dark-skinned woman with long, dark-brown hair, sculpted eyebrows, dark eyes, prominent cheeks and full lips."
2953,138298.jpg,A young man with short dark hair and small dark eyes. His nose is small and his lips are thin. His teeth are visible. A stubble beard is growing on his face
2954,044960.jpg,"A woman with long, straight, ombr hair going from dark-brown to blond. She is tanned."
2955,042035.jpg,"A plump, black man with full lips, a trimmed goatee, large ears and tattoos on his face. He is wearing a hat."
2956,024656.jpg,"A woman with long, slightly frizzy, dark-brown hair, a wide nose, full cheeks and a toothy smile."
2957,024656.jpg,"A middle-aged woman with voluminous hair. Her hair colour is brown and it is frizzy. Her eyebrows are thick and they match her hair colour. Her eyes are brown and small, her nose is wide and her lips, painted red, are stretched into a smile. Her lips are parted and her teeth are showing."
2958,094505.jpg,"A woman with a strong jawline and slightly hollow cheeks. She has thin, sculpted eyebrows and long, wavy, blond hair with dark roots."
2959,094505.jpg,A young woman with curled brown hair and small light-coloured eyes with black make-up around them. Her lips are thin and they are painted pink. She has got a kind smile
2960,025251.jpg,"A blonde girl with a round face wearing round white earrings. Brown roots are beginning to show. Her eyebrows are very thin, her eyes are small and dark-coloured with make-up around them, her nose is medium sized, and her lips are wide. She is smiling with her teeth showing."
2961,061302.jpg,"A woman with long, straight, black hair, a strong jaw and a pointed chin. She has small nose and is wearing heavy makeup."
2962,051612.jpg,"A balding, old man with some wispy white hair and red sunglasses."
2963,051612.jpg,A middle-aged man with some white hair at the sides of his head. He is wearing a pair of retro aviator sunglasses. His eyes are small. His lips are thin and his upper teeth are visible.
2964,073779.jpg,A young olive-skinned man with short black hair. His eyebrows are thick and straight. His eyes are small and narrow and he is smiling. His lips are slightly parted and his teeth are showing.
2965,192449.jpg,A young girl with dark hair pulled up. Her eyebrows are arched and her eyes are dark-coloured and big. There is dark make-up around her eyes. Her lips are thin and she has got a heavy lower lip. Her lips are slightly parted
2966,107940.jpg,A young man with hair covering also his forehead. His eyes are small and his lips are small and parted. His teeth are showing. Around his lips one could the mark of a shaved beard.
2967,168750.jpg,"A red faced man who seems to be in destress as he is squinting. He has short brown hair, a small nose and a slightly open mouth."
2968,136973.jpg,"A smiling young man with short, dark-brown hair. he has a wide nose and stubble around his chin and on his upper lip."
2969,136973.jpg,A young man with short dark hair and small eyes. His lips are thin and his upper teeth are visible as he is smiling. A stubble beard is growing on his face and he has also got a moustache.
2970,029306.jpg,"A man with white hair, beady brown eyes and narrow lips. He is wearing round prescription glasses."
2971,087411.jpg,"A man with short, light-brown, receding hair, sideburns, a large forehead, a pointed nose and a wide smile."
2972,166585.jpg,"A smiling woman with long, wavy, red hair with a fringe. She has a wide nose, full lips, sculpted eyebrows and full cheeks. She is wearing makeup and she has dimples."
2973,096305.jpg,"A woman with straight brown hair, pale skin, red lips and squinting eyes."
2974,111694.jpg,"A woman with long straight light brown hair, dark eyes, a straight nose and a full lower lip."
2975,111694.jpg,A young woman with brown hair and brown eyes. Her nose is small and her lips are thin. Her lips are painted pink. She looks quite serious
2976,112561.jpg,"A black man with shaved hair, full lips, a goatee, protruding ears and hollow cheeks."
2977,112561.jpg,"A dark skinned male with bushy eyebrows , a strong jaw and a thin moustache between a wide nose and large lips."
2978,139976.jpg,"A pale, Asian woman with neatly tied back dark-brown hair, thick eyebrows, full cheeks and a wide smile."
2979,139976.jpg,A young Chinese-looking girl with brown hair pulled up and small dark eyes with dark make-up around them. Her nose is small and her lips are thin. Her upper teeth are visible and she is smiling. 
2980,200041.jpg,"A pale, pouting woman with long, ombr hair, which is dark brown at the roots and gradually gets lighter towards the tips. She has a strong jaw, high cheekbones, a thin nose, sculpted eyebrows and she is wearing makeup."
2981,200041.jpg,A young woman with brown hair and blue eyes with some black make-up around them. Her nose is small and her lips are thick. Her lips painted with nude lipgloss.
2982,175982.jpg,A man with brown hair and a light brown beard. He has a snub nose and closed eyes.
2983,175982.jpg,A young man with short hair and a receding hairline. His mouth is open. His lips are thin and he has got a moustache.
2984,162379.jpg,"A pale man with short, receding, light-brown hair, a strong jaw with a cleft chin, high cheekbones and green, squinting eyes."
2985,162379.jpg,A middle-aged man with short brown hair and a receding hairline. He has got blue eyes and he is looking to his side. His lips are very thin and they are slightly parted. He has got a well-defined jawline.
2986,129533.jpg,A young woman with short dark-coloured hair. Her eyebrows are thick and her eyes are dark-coloured and big. There is some dark make-up around her eyes. Her lips are thick and she is smiling. Her upper teeth are visible
2987,113856.jpg,"A woman with tanned skin, a round face and a small nose. She has tied-back, brunette hair and she is wearing a tennis cap."
2988,087943.jpg,"A man with reddish skin, sideburns, thick eyebrows, a 5 o'clock shadow and a beaming smile. He is wearing a white cap."
2989,087943.jpg,A happily smiling man wearing a white cap over his short black hair.
2990,009978.jpg,"A young man with pale skin, a strong jaw, slightly hollow cheeks, full lips, narrow eyes and spiked up, light brown hair which is shorter at the sides."
2991,009978.jpg,A young man with short brown hair and some highlights. The hair in the middle of his head is styled upwards. His eyes are dark and small and his nose is small. His lips are heart-shaped and he has got a serious look. He is wearing a pair of earrings. His jawline is well-defined
2992,175674.jpg,"A woman with long, wavy, dark-brown hair, a small nose and a prominent chin. She is wearing sunglasses."
2993,175674.jpg,A young woman with wavy brown hair wearing a pair of big brown sunglasses. Her lips are thin and heart-shaped and they are painted with lipgloss.
2994,024667.jpg,"An Asian man with short, black hair, thick eyebrows, a large nose, dark eyes and a wide smile with dimples."
2995,087231.jpg,"A man with longish, tied-back hair, a thin nose and bushy eyebrows. He has a thin nose, a strong jaw and some stubble."
2996,087231.jpg,A young man with hair combed back. His eyes are small and his lips are thin. A stubble beard is growing on his upper lip and along his jaw. He looks quite serious
2997,100705.jpg,"A young man with short, dark brown hair and slight stubble. He has a wide nose and a defined jaw."
2998,111639.jpg,A young blonde girl with light-coloured eyes and thin lips. Her front teeth are visible. She has got a serious look on her face.
2999,019904.jpg,"A smiling woman with dimples and tanned skin. She has long, ombr hair, going from dark-brown to blond which is held back by a pair of sunglasses."
3000,019904.jpg,A young woman with dark hair and big dark eyes with dark make-up around them. Her lips are thin and her teeth are visible. She is smiling
3001,108057.jpg,"A slightly tanned boy with short, dark-brown, spikey hair, brown eyes and a wide, toothy grin."
3002,108057.jpg,"A young man with messy brown hair, smiling happily with a big toothy smile."
3003,171626.jpg,"A man with a chiselled jaw, hollow cheeks, green eyes and a wide nose. He has thin eyebrows and short, brown, curtained hair."
3004,171626.jpg,"A young man with medium length brown hair, a sharp jawline, wide jaw and green eyes."
3005,043085.jpg,"A woman with dark skin, long, brunette hair, sculpted eyebrows a small nose and a sharp jaw with a pointed chin. She had dark eyes and she is wearing light makeup."
3006,200915.jpg,"A black man with a shaved head and sunglasses. HE has full lips, a wide nose and a round face with a cleft chin."
3007,200915.jpg,A young dark-skinned man with a shaved head wearing black square sunglasses. He looks very serious. His nose is somewhat wide and his lips are thick.
3008,171001.jpg,"An old man with receding, white hair, a wide, flat nose, narrow eyes, full cheeks and a smile. He has a wrinkly face."
3009,171001.jpg,"An elderly man with grey receding hair, a wide nose, blue eyes and a small mouth."
3010,107888.jpg,A young woman with dark hair and blue eyes. There is heavy make-up around her eyes. Her nose is small and her lips are round. Her upper teeth are visible
3011,021015.jpg,"A pale man with short, curly, light-brown hair, light eyes, and a wide, toothy grin. He is wearing a cap."
3012,021015.jpg,A man wearing a fancy hat. His skin tone is fair and his eyes are big and light-coloured. He is smiling and his lips are parted. His teeth are visible. He has got medium-length brown curly hair.
3013,021441.jpg,"A woman with shoulder length dark blonde hair, dark eyes and thin lips. She is wearing black prescription glasses."
3014,021441.jpg,A woman with blonde hair and dark roots. Her eyes are brown and big and she is wearing a pair of glasses with a thick black frame. Her mouth is open and she seems to be opposing something or someone.
3015,041204.jpg,"A pale woman with long, slicked-back black hair, and a wide smile. She has a wide nose and slightly rosy cheeks."
3016,041204.jpg,"A woman with pale skin, slick black hair combed backwards, with a wide smile and thin lips."
3017,086067.jpg,"A man with short, spiked, light-brown hair and a trimmed beard. He has a wide nose and a smile with dimples."
3018,086067.jpg,"A man with light brown hair, square face and a long stubble. "
3019,189093.jpg,"A woman with long, wavy, reddish hair, a large forehead, drawn-on eyebrows and sharp features."
3020,189093.jpg,A young woman with voluminous red hair and small brown eyes with some make-up around them. Her lips are thin and they are painted red. She is wearing a pair of earrings
3021,153522.jpg,"A middle-aged man with short dark hair and small dark eyes,. His lips are somewhat thick and a thick beard has grown on his face. Most of the beard is white although parts of it are still darker."
3022,089963.jpg,A young girl with short black hair pulled at the back of her head. Her hair is parted at the side of her head. Her eyes are blue and there is dark make-up above them. Her lips are set in a straight line.
3023,134406.jpg,"A bald, black man with a large nose, full lips, high, prominent cheekbones and hollow cheeks."
3024,152869.jpg,"A woman with a white cap and bushy eyebrows. She has a round face, a wide nose and an open mouth."
3025,155609.jpg,"A chubby man with medium-length brown hair and bushy eyebrows. He has glasses, a wide nose and a double chin."
3026,155609.jpg,"A round male face with medium length wavy hair, narrow eyes with glasses and an open speaking mouth."
3027,083921.jpg,"A tanned old man with receding white hair, a large nose, a wide, toothy smile and a stubble beard. His face is round and slightly wrinkly."
3028,008492.jpg,"A pale woman with long, wavy, white-blond hair and bangs. Her eyes are closed and she is grimacing."
3029,020445.jpg,"A man with long, blond hair, a light-brown beard, a large nose, a wide smile and glasses."
3030,020445.jpg,A young blonde man with a fringe. He is wearing a  pair of big glasses with a thin metal frame. His mouth is open and his upper teeth are visible. He seems to be laughing. A beard has grown on his face
3031,065718.jpg,A young girl with a serious look. Her hair is blonde and straight but her eyebrows look brown. Her eyes are dark-coloured. She is looking from the corners of her eyes. Her lips are parted.
3032,001837.jpg,A young man with long braided hair. His skin tone is rather dark and his eyebrows are thick. His eyes are brown and they are small. His nose is straight and wide. His lips are really thick and big and his teeth can be seen from the gap between his lips. The man has got a thin beard. His neck is tattooed.
3033,057635.jpg,"A female face with red lips and cheeks, dark eyes and short messy brown hair. She also has a big smile."
3034,057635.jpg,A middle-aged woman with short brown hair. Her eyes are brown and small. She is wearing pink lipstick. The woman is smiling with her lips open and her teeth are showing. The woman has a diamond shaped face.
3035,005927.jpg,"A round male face with short straight black hair, very small lips and dark eyes. He is wearing glasses."
3036,005927.jpg,A Chinese-looking man with short dark-coloured hair and small dark eyes. He is wearing a pair of glasses with a thin metal frame. His lips are small and heart-shaped and they are slightly parted. The man seems to be focused on something.
3037,166960.jpg,A young lady looking quite sportive. She has got blonde hair but brown roots are coming out. Her eyebrows are brown and her eyes are also brown. She looks serious.
3038,093783.jpg,"A pale, smiling man with short, light-brown, curly hair, narrow eyes, a wide nose, dimples and a prominent chin with some stubble."
3039,093783.jpg,"A pale skinned man with ginger hair, stubble, small button nose and red lips in a wide smile showing laugh lines."
3040,059113.jpg,"A woman wearing a black beret, covering short brown hair. She has dark brown hair and very thin lips."
3041,146720.jpg,"A woman with long, wavy, black hair, sculpted eyebrows, a small nose and full cheeks. She is smiling and wearing makeup."
3042,040803.jpg,"A pale woman with a wide nose, a cleft chin and sculpted eyebrows. She is wearing a pink headscarf."
3043,084195.jpg,"A balding, older man with whitish hair, blue eyes, a large, slightly crooked nose, thin lips and a trimmed beard."
3044,084195.jpg,"An elderly man with orange and white hair and short beard, a large forehead, big nose and small blue eyes."
3045,128780.jpg,An old man with short grey hair and thick brown eyebrows. His eyes are small and his lips are thin. He has got a stern look
3046,065958.jpg,"A woman with long, wavy, blond hair with black roots. She has a small nose, thin, sculpted eyebrows and prominent cheeks."
3047,065958.jpg,A young woman with blonde curled hair and brown roots. Her eyes are light-coloured and small and there is some make-up around them. Her lips are thin and her upper teeth are visible. She is smiling
3048,066988.jpg,A woman with goggles on her head. She has a small nose and an open mouth.
3049,093771.jpg,A young Chinese-looking woman with long dark hair and a fringe. Her eyes are dark-coloured and there is some dark make-up around them. Her nose is straight. Her lips are thin. She has got a heavy lower lip. Her lips are painted pink. Her upper teeth are visible. She is smiling. She is wearing a pair of earrings
3050,183999.jpg,"A man with a strong jaw, a cleft chin and long straight hair. He is smiling."
3051,200208.jpg,"A black man with a chiselled jaw, shaved hair and a stubble goatee. He has thick eyebrows, dark eyes and full lips."
3052,200208.jpg,A young dark-skinned man with short dark hair and small dark eyes. His lips are thick and a stubble beard is growing on his face. His ear is pierced
3053,049533.jpg,"A pale man with a sharp jaw and light eyes. He has short, black hair, bushy eyebrows large ears and full lips. "
3054,049533.jpg,A young man with short dark-coloured hair and light-coloured eyes. His nose is small and his lips are thin. He has got a very sharply defined jawline.
3055,068048.jpg,A young woman wearing a tennis cap. She is looking up. Her eyes are blue. Her lips are parted and her upper teeth are visible.
3056,051238.jpg,"A woman with long, blond, bouffant hair and bangs. She is wearing heavy makeup, she has prominent cheeks and she is smiling."
3057,129681.jpg,"A middle-age man with dark-coloured skin talking into a microphone. His hair is very short, his eyes are dark and small. Around his lips he has got a thick beard growing. His lips are parted and both his upper and lower teeth can be seen."
3058,176333.jpg,"A young man with short, curly, dark-brown hair and bushy eyebrows. He has a wide nose and some slight facial hair."
3059,152337.jpg,"A young blonde man with small dark eyes, thin lips and a well-defined jawline"
3060,182973.jpg,"A profile shot of a man with pale skin and short, black hair. He has a long, pointed nose and a prominent chin."
3061,036709.jpg,An old man with a receding hairline and thinning hair. He has bushy eyebrows and is wearing tinted glasses.
3062,036709.jpg,An old man with short brown hair and a receding hairline. His skin is wrinkled. He is wearing a pair of glasses with tinted lenses. His lips are thin and hints of a stubble can be seen on his face
3063,002136.jpg,An Indian woman with brown hair pulled back. Her roots are a darker shade of brown. Her eye are dark-coloured and there is some make-up around them. Her lips are round. She is wearing a bindi
3064,177531.jpg,A young Asian man with gingerish hair and glasses. He has an angular chin and full lips.
3065,177531.jpg,A young Korean-looking man with short brown hair. His eyes are small and dark-coloured. He is wearing a pair of small oval-shaped glasses with a thin metal frame. He seems to be looking into the distance. His lips are slightly parted.
3066,106974.jpg,A young man with brown hair and bushy eyebrows. He has full lips and is frowning slightly.
3067,106974.jpg,A young man with short brown hair. His eyebrows are arched and his eyes are small and dark-coloured. His nose is small. He has got a beauty spot on the side of his face. His lips are somewhat thick. He looks focused
3068,073078.jpg,A young woman with blonde hair and darker roots.  Her eyes are blue and there is dark make-up around her eyes. Her lips are thin and her upper teeth are visible. She is smiling
3069,008820.jpg,A young blonde man with blue eyes. His nose is straight and his lips are very thin. He is smiling
3070,096004.jpg,"#a dark-skinned man with short, curly hair, thick eyebrows, dark eyes, a beaky nose and full lips."
3071,096004.jpg,"A young man with curly shoulder length hair, close set large eyes, a big nose and no facial hair."
3072,179449.jpg,A middle-aged woman with brown hair and dark eyes. There is black make-up around her eyes. Her lips are thin. She is wearing a pair of earrings.
3073,123875.jpg,"A pale man with short, slightly receding, brown hair, thick eyebrows, blue eyes, hollow cheeks and a faint 5 o'clock shadow."
3074,162782.jpg,A young woman with wavy blonde hair and a fringe. Her eyes are dark and small and her lips are thin. Her teeth are visible. The woman seems to be crying
3075,019814.jpg,A young man with short black hair and a 5 o'clock shadow. He is pale-skinned and scowling.
3076,094045.jpg,A young woman with brown hair and small dark eyes with heavy black make-up around them. Her lips are thin and her upper teeth are visible
3077,113812.jpg,A Chinese woman with straight brown hair and thin eyebrows. Her eyes are dark-coloured and there is black make-up around them. Her nose is small. Her lips are painted with natural colour lipgloss and they are slightly parted. Her teeth are showing.
