,FileName,Description
0,178619.jpg,"An Asian woman with long, wavy, brunette hair, sculpted eyebrows, full lips and a roundish face with a strong jaw."
1,178619.jpg,A young Chinese-looking woman with long brown hair and small dark eyes. Her nose is small and her lips are somewhat thick. She has got a heavy lower lip
2,043353.jpg,"A man with short, brown hair and a receding hairline. He has stubble on his strong jaw, large ears and a slight grin."
3,043353.jpg,A young man with short brown hair and a few wrinkles on his forehead. His eyebrows are thick and his eyes are small and dark-coloured. His lips are very thin and a stubble beard is growing around them
4,094966.jpg,"A woman with a blond bob cut and dark roots. She has full lips, prominent cheeks and she is wearing makeup."
5,094966.jpg,A young woman with bob blonde hair and a fringe. Her roots are dark. Her eyes are small and there is some make-up around them. Her lips are painted pink and they are stretched into a smile
6,060553.jpg,A middle-aged man with short brown hair and dark-coloured eyes. He has got a straight nose and his lips are thin and heart-shaped. A stubble beard and hints of it can be seen on his face. The man's skin tone is very pale.
7,161574.jpg,"A man with short brown hair shaved at the sides of his head. His eyes are dark-coloured and small, his nose is somewhat wide and his lips are wide yet thin. Around his lips a stubble beard is growing."
8,051193.jpg,"An Asian man with longish, black hair and a fringe.  He has prominent cheekbones, a large nose and bushy eyebrows."
9,051193.jpg,A Korean-looking man with short dark-coloured hair and a fringe at the side of his head. His eyebrows are thick and his eyes are small and somewhat narrow. His nose is straight. The man is smiling.
10,075337.jpg,"An old man with receding, white hair, dark, bushy eyebrows, a large nose and a wide toothy smile. He has a long, droopy face."
11,075337.jpg,A happy looking elderly man with grey hair combed backwards revealing a large forehead and bushy black eyebrows.
12,082180.jpg,"An old man with a bald head and short, dark brown hair on the sides. He has sunken, brown eyes, a larhe nose, large ears, a wide smile and a wrinkly face with droopy features."
13,082180.jpg,"A bald old man with brown hair on the sides of his head. His eyes are brown and small. His lips are very thin, he is smiling with his lips parted and his upper teeth are visible. Wrinkles can be seen on his face."
14,122613.jpg,A young man with short curly brown hair. His eyes are blue. His lips are thin and they are curved into a smile. A beard is growing around his lips. He has got a well-defined jawline.
15,052246.jpg,"A pale young man with long, black hair and a beanie. He has a brown-chinstrap beard and is wearing makeup. He also has a wide nose and a lip piercing."
16,039055.jpg,An Asain man with short black hair and a receding hairline. He is wearing glasses and he has a round face and bushy eyebrows.
17,039055.jpg,"An east asian man wearing glasses and having short greying hair, a round face and a sad expression."
18,074840.jpg,"A pale woman with long, brunette hair, full lips, sculpted eyebrows and a long nose."
19,074840.jpg,A young woman with straight dark hair and big dark eyes. There is some black make-up around her eyes. Her lips are somewhat thick and her upper teeth are visible. She is wearing a pair of earrings
20,149737.jpg,"A man with a round face, short, receding black hair, a pinched nose, a stubble beard and a wide, toothy smile."
21,155358.jpg,A young woman with brown hair pulled backwards. She is looking upwards and her lips are pursed. It seems like she is about to cry.
22,157155.jpg,This man has a round face and a receding hairline. He is wearing glasses atop his wide nose and he has a beaming smile.
23,034454.jpg,"A woman having blonde wavy hair, green eyes and a straight nose. She has red lips and is wearing makeup."
24,056655.jpg,"A young woman with wavy, dark-brown hair. She has a cleft chin and an oval-shaped face. "
25,056655.jpg,A young woman with dark hair. Her eyes are dark-coloured and there is some black make-up around them. She looks quite serious. Her lips are thin and her face is oval-shaped.
26,100652.jpg,"A pale woman with long, slightly wavy, blond hair, blue eyes, thin eyebrows, a small nose and a slight smile."
27,100652.jpg,A young blonde girl with blue eyes. Her nose is small and her lips are thin. Her lips are painted red and her upper teeth are visible. She is smiling
28,101227.jpg,"A pale young woman with long, straight, dark brown hair.  She has a wide nose, a cleft chin and is smiling slightly."
29,193066.jpg,An old man with a shaved head and greying hair. He has thin eyebrows and wrinkles.
30,193066.jpg,An old man with short dark hair and small dark eyes. His nose is big and his lips are somewhat thick. He looks serious
31,197282.jpg,A woman with voluminous long brown hair parted in the middle of her head. Her skin tone is a little darker than olive. Her eyes are dark-coloured and there is dark make-up around them. Her lips are heart shaped and they are parted. Her upper teeth are visible. She is staring.
32,044864.jpg,"A tanned man with short, spiky, light-brown hair, a large nose, a toothy smile and some stubble."
33,044864.jpg,A young man with brown messy hair and yellow highlights. His eyebrows are thick and his eyes are almost closed. The man's lips are thin and they are parted. His upper teeth are visible.
34,080914.jpg,"A black woman with long, straight, black hair with bangs. She has dark eyes, a round face and full lips accentuated by her makeup."
35,081413.jpg,"A man with big eyes and a full lower lip. He has wrinkles, hooded eyes and slight facial hair on his upperlip. "
36,119451.jpg,"An older man with grey, receding hair. He is wearing glasses and has a large nose and a wide smile."
37,119451.jpg,An old man with grey. His eyes are small and dark-coloured and he is wearing a pair of big squarish glasses. He is smiling. His lips are very thin and his upper teeth are visible.
38,014849.jpg,"A pale woman with a reddish-brown bob cut, blue eyes, a wide nose, full cheeks and a slight smile. She is wearing light makeup."
39,033900.jpg,A young man with short dark-coloured hair and thick dark-coloured eyebrows. His eyes are small and they're green. His lips are thin and they are pressed together. The guy seems to be smirking. A stubble beard is growing on his face.
40,087706.jpg,A middle-aged woman with straight blonde hair and big dark eyes. There is dark make-up around her eyes. Her nose is somewhat big and her lips are thick and they're painted red. She is smiling
41,187553.jpg,"A tanned man with longish, wavy black hair, sideburns and a thin moustache. He has a square face and thick eyebrows."
42,187553.jpg,A young man with short dark hair and small dark eyes. His nose is small and his lips are pretty thin. A moustache has grown on his face and there is also facial hair on his chin
43,112508.jpg,"A man with receding, dark-brown hair, thick eyebrows, blue eyes and a wide, toothy smile. He has a wrinkly face and large ears."
44,169399.jpg,"A man with a strong jawline and a cleft chin. He has short, brown hair, large ears and a thin nose."
45,075307.jpg,"A woman with high cheekbones, hollow cheeks and a strong jaw. She has long, curly blond hair, a thin nose and dark, sculpted eyebrows."
46,110054.jpg,A young girl looking downwards. Her hair is brown and it is long and straight. Her eyebrows are thin. Her eyes cannot be seen. Her lips are wide and they are stretched into a smile. Her front teeth are visible.
47,114556.jpg,A middle-aged with blonde hair and blue eyes. His lips are pursed and he is smiling.
48,163961.jpg,A young man wearing a cap. He is also wearing a pair of black sunglasses. His lips are thin and they are slightly parted. His upper teeth are visible. He is smiling and he is holding a baseball ball in one hand.
49,187030.jpg,A young woman with dark-coloured curly hair and small eyes. Her lips are pouted and she seems to be admiring something or someone
50,113082.jpg,A man with short straight brown hair and brown eyes. He has a very narrow upturned nose and a small mouth. He also has stubble beard.
51,135194.jpg,"A woman with long, straight, black hair and bangs. She has a wide nose and a strong jaw with a pointed chin. She is wearing makeup and has a lazy eye."
52,135194.jpg,"A young woman with straight dark hair and a fringe. Her eyes are dark-coloured and there is black make-up around the, Her lips are thin and they are pressed together. She is smiling softly. The woman seems to have a pointy chin"
53,124094.jpg,A young woman with blonde hair pulled back and bright blue eyes with some make-up around them. Her nose is small and her lips are heart-shaped. She is smiling
54,087158.jpg,"An Asian person with short, dark-brown hair, a flat, wide nose, prominent cheeks and a smile."
55,087158.jpg,A Korean-looking woman with short hair combed backwards. Her eyes are small and her nose is a little wide. Her lips are thin and they are slightly parted. Her upper teeth are visible.
56,045150.jpg,"A young male face with dense brown hair, blue eyes and a happy smiling expression."
57,168292.jpg,"A man with short brown hair, light coloured expressive eyes and a pair of straight lips. He seems to have a sad look."
58,041279.jpg,"A woman with pale skin and heavy makeup, in particular, green lipstick and eyeshadow. She is pouting and has long black hair."
59,041279.jpg,A young woman with heavy make-up. Her hair is dark and straight. Her eyes are dark and there is a lot of dark make-up around them. Her lips are painted in a dark lipstick. She looks scary
60,054267.jpg,"A man with short, receding, curly, brown hair and a trimmed, salt-and-pepper beard. He has a wide nose and crow's feet."
61,054267.jpg,"A middle-aged man with dark coloured curly hair and small brown eyes. His eyebrows are bushy. His lips are somewhat thick and a thick stubble beard is growing around them. Although it is mostly black, there are some white patches"
62,195217.jpg,"An old man with white, receding hair, a large nose, large ears, pale skin with reddish tones and a round, wrinkly face."
63,034627.jpg,"A black man with shaved hair, thick eyebrows, a flattish nose, full lips and a smile. He has prominent cheekbones, some light facial hair and earrings."
64,005533.jpg,"A pale woman with long, brunette hair and and a huge smile. She is wearing light makeup and has thick eyebrows."
65,007090.jpg,"A woman with long ginger hair, dark eyes and a small nose. She has very full lips."
66,007090.jpg,A young Chinese-looking girl with brown hair and small eyes with dark make-up around them. Her lips are heart-shaped and her front teeth are visible.
67,100899.jpg,"A woman with long, brown hair and heavy makeup. She has sharp features, with a small nose and hollow cheeks."
68,100899.jpg,A middle-aged woman with dark hair and a fringe and big blue eyes with dark make-up around them. Her nose is small and she has got a heavy lower lip
69,103402.jpg,"A man with short, dark-brown, receding hair, a large nose, thin lips, a cleft chin and a long, plump face."
70,128450.jpg,"A pale, gaunt man with short, light-brown hair, thick eyebrows, a chin beard and a moustache. He has protruding ears and he is squinting his eyes."
71,159428.jpg,"A pale woman with long, blond hair, dark eyebrows, dark eyes, a wide nose and a toothy grin."
72,058192.jpg,"A woman with a long face, a very thin, short nose, thin lips and deep set eyes. She has long caramel-blonde wavy hair."
73,058192.jpg,A young woman with wavy brown hair and small brown eyes surrounded with black make-up. Her nose is small and her lips are thin. Her upper teeth are visible as she is smiling. She is wearing a pair of hoop earrings
74,151073.jpg,"A dark-skinned older man with a double chin and a wide nose. He has full lips and receding, greying hair."
75,034993.jpg,"An old man with wavy, grey hair underneath a hat. He has a large, slightly crooked nose and thin lips. His face is squarish and wrinkly."
76,034993.jpg,An old man with a rocker look. He is wearing a grey hat and a bandana underneath it. His eyes are brown and he is wearing dark eyeliner. Wrinkles can be seen on his face. His hair is grey. His lips are thin. His ear is pierced
77,138811.jpg,"A bald, plump man with blue eyes, full lips and a trimmed chin beard. He has small eyebrows and he is wearing a black cowboy hat."
78,138811.jpg,A chubby young man with light-coloured eyes and thin lips. He is smiling and hints of a stubble beard can be seen on his upper lip. A stubble beard is growing on his chin.
79,156625.jpg,"A woman with long, wavy, blond hair, a large nose and blue eyes. She is wearing heavy makeup and she has thin, drawn-on eyebrows."
80,053896.jpg,"A woman with long, straight, black hair, blue eyes and sculpted eyebrows. She has full cheeks and full lips accentuated by her makeup."
81,065583.jpg,"A tanned woman with shoulder length, brown hair. She has a long nose and a smile on her face."
82,092508.jpg,A middle-aged man with short dark hair and small blue eyes. His nose is relatively big and his lips are thin. His upper teeth are visible as he is smiling. A stubble beard is growing on his face. His jawline is well-define
83,088011.jpg,A middle-aged man with short brown hair. There are some white patches as well. His eyes are big and his lips are pursed. He looks worried.
84,151471.jpg,"A pale man with short, dark-brown hair which is shaved at the sides, a pair of sunglasses and protruding ears. He has a stubble beard and a slight smirk."
85,166281.jpg,"A young slim woman with brown hair and small, narrow, dark eyes. Her nose is small and her lips are thin. Her upper teeth are visible and she is smiling."
86,068028.jpg,"An old man with short, curtained, white hair, reddish skin, light eyes, a slanted mouth and a wrinkly face."
87,068028.jpg,"An old man with yellow-white hair and wrinkled skin. His eyes are light-coloured, his lips are pressed together and hints of a stubble beards can be seen around his lips."
88,177510.jpg,"A young man with a chiselled jaw and bushy eyebrows. He has short, dark-brown hair which is parted in the middle and a slightly crooked nose."
89,083166.jpg,"A young woman with brown hair and a long fringe. She is wearing a headband. Her eyes are dark-coloured, her nose is small and her lips are heart-shaped and they are painted pink."
90,086339.jpg,"A black woma with tied-back, black hair and a fringe. Her eyes are brown and she has sculpted eyebrows and a wide smile."
91,188053.jpg,"A woman with long, straight, blond hair and dark roots. She has a long nose, light eyes, prominent cheeks and a smile with dimples."
92,188053.jpg,A middle-aged woman with straight blonde hair and brown roots. She has got a fringe. Her eyebrows are thin and brown and her eyes are blue. Her lips are set into a smile. Her skin is glowing. She is wearing a pair of long earrings.
93,124583.jpg,"An old man with reddish skin, short, grey, receding hair, a long nose, thin lips and a squarish face with droopy features."
94,134159.jpg,"A man with shaved hair, thick eyebrows and dark eyes. He has a wide nose, a smile and some trimmed facial hair."
95,159035.jpg,"A woman with long, wavy, ginger hair, bangs, blue eyes, a sharp jawline and full lips. She has sculpted eyebrows and she is wearing makeup."
96,159035.jpg,A young girl with wavy brown hair and a fringe. Her eyes are blue and there is some make-up around them. There's also some make-up underneath her eyes. Her lips are painted with lipgloss and they are thick. Her teeth are visible.
97,182841.jpg,A middle-aged woman with curly blonde hair. Her eyes are blue and big. Her lips are thin and they are painted red. Her upper teeth are visible and she is smiling
98,041138.jpg,A man with medium-length scruffy wavy hair. He is looking sideways and he has a serious look. His facial features are rather small. The man has got a moustache on his upper lip and facial hair under his lower lip and around his jaw.
99,127653.jpg,A middle-aged woman with bob hair. Her head is tilted back and she is looking in the distance. Her eyebrows are thin and her eyes are small. Her lips are very thin. She is wearing a pair of small earrings.
100,005982.jpg,An old man with short white hair wearing a pair of black sunglasses. There is an eye patch3 covering one of the lenses. He has got a heavy lower lip.
101,139685.jpg,"A woman with frizzy, ginger hair, fair skin, and angular features. She is wearing heavy makeup, dangly earrings and a jewelled hairband."
102,085983.jpg,"A young woman with her hair dyed blonde. Her roots are dark-coloured. Her eyes are dark-coloured, her nose is small and her lips are somewhat thick. Her cheekbones are well-defined."
103,114239.jpg,A bald young man with brown eyes. He is wearing a pair of oval shaped glasses with a thin metal frame. His lips are thin and a beard is growing around his lips and along his jawline. He looks serious
104,048477.jpg,"A man with a light-brown bowl haircut and thick, bushy eyebrows. He has a wide nose, a 5 o'clock shadow and a grin."
105,090874.jpg,"A young woman with thin raised eyebrows and a well-defined jaw. She has long, wavy brunette hair and is crossing her eyes."
106,090874.jpg,A young woman with brown hair and small dark-coloured eyes. Her lips are thin and she is pouting. Her teeth are visible.
107,131709.jpg,A young boy with hair combed backwards and gelled. The sides of his head are shaved. He has got a stern look. His eyes are brown and his lips are heart-shaped.
108,132215.jpg,"A plump man with short, receding, black hair, thick eyebrows, a small nose, thin lips and a pair of glasses."
109,132215.jpg,A middle-aged man with short dark-coloured hair and a receding hairline. His eyes are dark-coloured and small. He is wearing a pair of glasses with a thin frame. His lips are thin. Hints of a moustache can be seen on his face
110,127869.jpg,"An Asian man with short, black hair, a fringe, a wide, toothy smile and soft features. He is wearing glasses."
111,127869.jpg,A young Korean-looking man with medium-length dark hair and a fringe. His eyes are dark-coloured and small and he is wearing a pair of glasses. His nose is small and his lips are thin. His upper teeth are visible and he is smiling
112,167689.jpg,"A man with long, dark-brown hair held back by a black hairband. He has a wide nose, bushy eyebrows, stubble beard and a toothy grin. "
113,167689.jpg,A young man wearing a sports band. His eyes are dark-coloured and his lips are thin. His teeth are visible as he is smiling. Hints of a stubble can be seen on his face
114,027688.jpg,"A black man with a shaved head, bushy eyebrows, small ears, full lips and a goatee."
115,163841.jpg,A black haired man with a long nose and a sideways wrinkly smile.
116,195276.jpg,"A dark-skinned woman with neatly tied back dark-brown hair, sculpted eyebrows, full cheeks, a wide smile and some makeup."
117,009341.jpg,"A woman wearing a lot of makeup, bright pink lipstick and  large earrings, having pale white skin and red hair."
118,078927.jpg,"A black woman with long, slightly wavy, black hair, thin eyebrows, full cheeks, full lips and a bright smile."
119,078927.jpg,"Dark skinned woman with a slight underbite, plucked arched eyebrows, long wavy black hair with one side pinned back and a happy smile."
120,154789.jpg,"A man with short, brunette hair, thick eyebrows, light eyes, a long nose and a stubble beard and moustache. He has thin, smiling lips and a prominent chin."
121,154789.jpg,A young man with short brown hair and light-coloured eyes. His lips are very thin and he is smiling. A stubble beard is growing on his face.
122,048202.jpg,"A dark-skinned woman with long, curly, brown hair, a wide, toothy grin, rosy cheeks and some makeup."
123,060523.jpg,"A slightly smiling female face with small lips and nose, large eyes and medium length wavy dark brown hair."
124,173304.jpg,"A woman with caramel-toned wavy hair, prominent brown eyes and pink lips with a slight smile."
125,166654.jpg,"A young boy with longish, light-brown hair and a fringe. He has soft features and a small nose."
126,166654.jpg,A young boy with short brown hair and small brown eyes. His nose is small and his lips are thin.
127,190994.jpg,"An Asian woman with long, slightly wavy, brown hair, dark eyes and thick eyebrows. She also has a round face and full lips."
128,190994.jpg,A young Chinese-looking girl with straight brown hair and dark eyes. Her nose is narrow and her lips are somewhat thick and round. Her front teeth are visible
129,138106.jpg,"A pale woman with short, curly, brown hair, green eyes and drawn-on eyebrows. She has full cheeks, a toothy grin and she is wearing light makeup."
130,138106.jpg,"A woman with short curly brown hair, thinly drawn on eyebrows, blue eyes and a large aquiline nose."
131,059067.jpg,A young blonde girl with very small narrow eyes. Her lips are thin and her mouth is open as she is laughing. Her teeth are visible.
132,161596.jpg,A young woman with dark hair and small blue eyes. There is some dark make-up around her eyes. Her lips are thin and she has got a heavy lower lip. She looks serious
133,067120.jpg,"A pale woman with wavy, blond hair, a fringe, thin eyebrows, a small nose and some makeup. She has pouted lips and hollow cheeks."
134,067120.jpg,"A woman wearing a lot of makeup, small earrings and red lipstick, having blonde hair and squinting as if blowing from her mouth."
135,097570.jpg,"A profile shot of a person with short, very curly, brown hair, a slightly beaky nose, brown eyes, thick eyebrows and soft features."
136,097570.jpg,A young man with medium-length curly brown hair and small eyes. His nose is small and his lips are thin. He seems to have a genuine smile
137,042217.jpg,"A man with puffy dark brown hair, dark eyes and a very straight nose. His lips are very thin and he is wearing prescription glasses."
138,191176.jpg,"A man with short, light-brown hair, a large nose and a prominent chin. He is wearing glasses and he has brown eyes."
139,071144.jpg,"A woman with long wavy black hair pulled backwards, grey eyes, and wearing makeup, small earrings and glossy lipstick."
140,102011.jpg,"A woman with long brown hair, big upturned dark eyes and full lips with white teeth. She has a very dark complexion."
141,131877.jpg,A young girl with wavy blonde hair and dark roots. Her eyes are blue and there is heavy black make-up around them. Her nose is small and her lips are thin.
142,031117.jpg,"A smiling young woman with dark brown, tied-back hair. She has an angular jawline and thin eyebrows."
143,031117.jpg,A young woman with dark hair pulled back. Her eyes are dark-coloured and big. Her nose is small and her lips are thin. She has got a pointy chin. She is smiling and she is wearing a pair of earrings
144,075744.jpg,"A young man with medium-length brown hair and fringe. He is looking up in a scary way. His eyes seem small, his nose looks straight and his lips are pressed. There is a stubble beard growing."
145,103184.jpg,An older man with greying hair and a cleft chin. He has bushy eyebrows and a big nose.
146,103184.jpg,An old man with black-grey hair and eyebrows of the same colour. His eyes are small and his nose is straight. His lips are looking somewhat pouty and the man seems to be speaking. A double-chin can be seen.
147,098121.jpg,"A pale woman with tied back, blond hair, dark eyes, a strong jaw and a pointed chin. She is wearing makeup and earrings."
148,098121.jpg,A young woman with brown hair pulled back. Her eyes are dark-coloured and big and there is some dark make-up around her eyes. Her nose is small and her lips are heart-shaped. She is wearing a pair of hoop earrings
149,083935.jpg,"A woman with long, straight, black hair and bangs. She has prominent cheeks and full lips with a dimpled smile."
150,190426.jpg,A black woman with light makeup and a beaming smile. She is wearing a yellow hat and dangly earrings. Her eyebrows are sculpted and she has prominent cheeks.
151,005561.jpg,"A young girl with a round face and a beaming smile. She has long, brown hair and she is wearing light makeup."
152,032403.jpg,A young woman with straight long dark hair and small brown eyes. Her lips are thin and she is smiling. Her upper teeth are visible.
153,043664.jpg,"A man with short, blond hair and green eyes. He has a long nose and a sharp jaw with a cleft chin."
154,087007.jpg,A young lady with brown hair pulled back. She is wearing a pink hairband. Her eyes are dark-coloured and her complexion is very pale. She is smiling.
155,039549.jpg,A young man with short brown hair and blue eyes. His eyebrows are round. His lips are thin and he seems to have a heavy lower lip. He has got a stubble beard on his face.
156,087533.jpg,"A young black woman with sculpted eyebrows and makeup. She has wavy brunette hair and a round, contoured face."
157,041198.jpg,"A man with a serious look on his face. He is looking as though he is observing something. His eyebrows are thick and his eyes are small. His lips are thin and he is smirking, his lips are slanted in shape."
158,140650.jpg,A dark-skinned man wearing a white cap and a pair of dark-glasses. His eyes are brown and his lips are round and very thick. He has got a serious look on his face.
159,192272.jpg,"A woman with straight, blond hair, kept back by a pair of headphones. She has full cheeks, a bright smile and she is wearing makeup."
160,192272.jpg,A young woman with blonde hair wearing a pair of headphones. Her eyes are almost closed as she is smiling and laughing. Her lips are thin and her upper teeth are visible
161,201601.jpg,A young girl with wavy brown hair parted at the side of her head. Her eyebrows are brown and her eyes are blue. There is black make-up around them. Her lips are very thin and they're painted red. She has got a diamond-shaped face.
